par_id,art_id,text,keyword,country,label
10467,@@20282330,""""""" she has one huge platform , and information can go out to places that really need to know what 's going on in her hometown . she has always availed not only her platform , her voice , but also resources -- tangible resources -- to help those most in need in houston and around . """"""",in-need,ng,[1 0 0 0 0 0 0]
6052,@@15004107,"2017 budget : more needs to be done for disabled , say groups",disabled,my,[1 0 0 1 0 0 0]
7110,@@19763834,""""""" for example , we also extended help to the people of yong peng , which is under the opposition , because it is our responsibility to help those who are in need , """" he added .""",in-need,my,[1 0 0 0 0 0 0]
5082,@@14685994,asws ceo di gipey said the coroner 's report into the deaths of two women after long histories of domestic violence again highlighted the pressing need to make real changes that will make women and children safe .,women,au,[1 0 0 1 0 0 0]
7359,@@1890329,"""vodafone foundation director andrew dunnett said : """" there were 16.7 million refugees worldwide at the end of 2013 and 50 per cent of them are under the age of 18 . tablet-based learning programmes will provide many of the children in dadaab with an unlimited information resource that they would otherwise not have had . """"""",refugee,gh,[1 0 1 0 0 0 0]
1556,@@20808482,"saudi arabia 's king salman on tuesday ordered that women be allowed to drive cars , carrying out a major reform that rights activists have been demanding for a long time in the islamic kingdom . through ...",women,hk,[1 0 0 0 0 0 0]
2382,@@10133269,"thousands of people made homeless in an eviction drive in kalyanpur slum on thursday are occupying the open spaces around the shanty town that they called home , after bulldozers razed their dwellings to the ground .",homeless,bd,[0 0 0 0 0 1 0]
1416,@@24260078,"in each and every town or city where a caxton local paper is distributed , you will find them immersed in their communities , providing assistance with projects that uplift society . a stand-out community newspaper initiative is dice ( do i care enough ) , a vital component of the zululand observer , indelibly linked to zululand since 1973 . not only is it involved in the care of the vulnerable and dispossessed , but it is active in all spheres of community upliftment wherever the need may be .",vulnerable,za,[1 0 0 0 0 1 0]
5948,@@1791511,"discrimination of the disabled by society is one of the major problems undermining the progress of democratic practice in the country . it is always the dream of people with disabilities that so long as the disability bill is passed , their position in society will be influenced positively .",disabled,gh,[0 0 1 1 0 0 0]
2477,@@23829421,"themed ' march for our lives ' , the protesters included children , teenagers , pregnant women , the old and not excluding the disabled who rolled over on their wheel chairs .",disabled,ng,[0 0 0 0 0 1 0]
6211,@@14473620,""""""" i think another main theme is the power of human resilience and bounding back from the ashes of ruin , and being willing as a really young person to speak out and to try and get justice . the bravery of these young women has just been astounding to us. """"""",women,au,[0 0 0 0 1 0 1]
1964,@@22061199,hospitals fill as rohingya refugees shiver through winter,refugee,my,[0 0 0 0 1 1 0]
4466,@@23398086,she said these women deserve the same kind of choice that any women anywhere in the world should have .,women,bd,[1 0 0 0 0 0 0]
5684,@@3950612,"varanasi : over six decades to independence and the muslim community may still be lagging behind in the field of education . but , a number of muslim women and girls-- particularly hailing from poor families-- are coming out to dispel the darkness of ignorance and bring about a new dawn for the coming generation of the community . they are doing the community proud by making sincere efforts at spreading literacy , especially among other girls and children .",poor-families,in,[0 0 1 0 1 1 1]
2695,@@60002247,"what we have instead observed has been an ever-escalating education arms race , in which the poorest children have ended up hopelessly ill-equipped to fight . the signs are all around us : the booming billion-pound industry of private tutors paid to boost pupils ? ? ? grades ; the sharp-elbowed tiger parents stopping at nothing to get their children into the best schools , and the stressed-out students trying to navigate a complex and often baffling university admissions system .",hopeless,ie,[0 0 0 0 1 1 0]
10424,@@4665292,""""""" i do n't believe in abortion , i think it is wicked . i would tell women to have their child and god will provide , """" said julene .""",women,jm,[1 0 0 1 0 0 0]
2581,@@1857981,"the ten wheelchairs were sought for children identified by the host , salvation army to enable them to become mobile , the convener noted . baps charity would go anywhere to donate provided there are found people in need of the donations without any discrimination relating to religion , colour , origins or tribe , he stated .",in-need,tz,[1 0 0 0 0 0 0]
266,@@70060527,""""""" as briggs &amp; stratton celebrates its 110th anniversary year , what better way to reaffirm our commitment to the milwaukee community than by providing $1 million to kids in need of pediatric care , """" said rick carpenter , vice president corporate marketing . """" we are lucky to have one of the nation 's top pediatric hospitals right here within our community and briggs &amp; stratton firmly stands behind its commitment to extend its support into the future . """"""",in-need,us,[1 0 0 0 0 0 0]
9126,@@4163239,yes ... because there is no hope where he lives . india is a third-world country . do n't be fooled by call centers in big cities . most of the country is rural and most of the population is illiterate and hopeless .,hopeless,us,[1 0 1 0 0 1 0]
3399,@@16078637,"for refugees begging for new life , christmas sentiment is a luxury most of them could n't afford to expect under shadow of long-running conflicts .",refugee,gh,[0 0 1 0 0 1 0]
7138,@@864350,"for 12 years ruby* lived a life of abuse , drugs , homelessness and prostitution . but two months ago she joined the lucky few to escape the horrors of prostitution .",homeless,za,[0 0 0 0 0 1 0]
8206,@@25353932,"in an unmarked brick building , a few blocks from the mexican border , immigrant parents clutched folders of birth certificates and asylum paperwork and sat on folding chairs , waiting to use a single , shared landline phone .",immigrant,au,[0 0 0 0 0 1 0]
206,@@25312066,"""smyth told hkfp : """" the biggest challenge is the no work policy . i think that refugees who come here , or asylum seekers , they 're unable to work and they have kids here -- their kids are stateless . that 's really the cause of a lot of stress in the community . """"""",refugee,hk,[0 0 1 0 0 1 0]
8165,@@15581452,"through gawad kalinga , meloto has proven to be a key player in the housing industry , helping provide decent homes and sustainable livelihood to the marginalized and homeless filipinos .",homeless,ph,[1 0 0 0 0 1 0]
7341,@@14684361,egypt billionare offers to buy mediterranean island for refugees,refugee,in,[1 1 0 0 0 0 0]
4963,@@19189672,"pageants sa 's main charity is the dignity dreams project , where re-usable , washable sanitary towels are given to schoolgirls in need .",in-need,za,[1 0 0 0 0 1 0]
5827,@@8863336,"the residents of poranu kotuwa who were deprived of healthy and independent lives in normal weather conditions , are facing a truly hopeless future .",hopeless,lk,[0 0 1 0 0 1 0]
343,@@16043067,"""helen schafer chose to help a family in need . """" rather than sending out gifts to my clients , i 've sent them a letter effectively saying : ' this is what we 're going to do because it feels a hell of a lot more meaningful ' . """"""",in-need,nz,[1 1 0 0 0 1 0]
8630,@@7711150,""""""" every family which qualifies for the program should be covered . every child in poor families must be placed and kept in school , and they should enjoy health and nutrition assistance , romualdez said .""",poor-families,ph,[1 0 0 1 0 0 0]
6811,@@9104782,"while many muslims can count on their blessings , they should not forget the fate of those who are poor and in need of help .",in-need,my,[1 0 1 1 0 1 0]
717,@@21283598,"this year in recognition of their ongoing dedication and charitable sacrifice to help all those in need through mutual help , true comradeship and sound memory over the past 90 years , the moths of the better ' ole shellhole will stand proudly to attention as guard of honour and sentries for the duration of this year 's wayside cross remembrance ceremony .",in-need,za,[1 1 0 0 0 1 0]
1117,@@23790642,"""despite having excellent academic qualifications , rani is shown the door at innumerable interviews for a teaching position . after five years , she finally gets a job at st notkers , but there 's a catch . she is given the notorious 9f , the """" hopeless """" students from the nearby slums who study in the school by virtue of the right to education , but are neither accepted by the teachers nor by the students .""",hopeless,in,[1 0 1 0 0 1 0]
1482,@@4543046,"aklima sultana , a teacher of the institution , told the daily star , ? i feel very proud when i think i teach underprivileged students coming from very poor families. ?",poor-families,bd,[1 1 0 0 0 1 0]
5195,@@14778748,"but what is most striking about mr. trump 's answer is the bleak picture he pains of inner-city america and black life : poverty , gun violence , poor education and hopelessness .",hopeless,ca,[0 0 1 0 0 1 0]
6988,@@16437918,"after vatican controversy , mcdonald 's helps feed homeless in rome",homeless,bd,[1 1 0 0 0 0 0]
9850,@@16437918,"pope francis has made defence of the poor and needy a cornerstone of his papacy , setting up shower stalls for the homeless near the vatican , offering meals and even a vip-style visit to the sistine chapel .",homeless,bd,[1 1 0 0 0 0 0]
8093,@@16376348,""""""" most of the time , you will hear people advocating the inclusion of women in governance because they are vulnerable . what most people fail to recognise , however , is that disabled persons are even more vulnerable than women and need to be supported , """" he added .""",disabled,gh,[1 0 1 1 0 0 0]
8894,@@24243180,""""""" we want to supply these bicycles for vietnamese students from poor families in remote areas so that they can pursue their studies , """" said michael shuman , a former u.s. marine .""",poor-families,sg,[1 1 0 0 0 0 0]
1899,@@4619315,"the kalpana chakma case demonstrates how subjugating a people is achieved by attacks on women and how those guilty of it are allowed to get away scot-free . this woman showed outstanding courage , a lion heart who spoke up for the violated until she , herself , was violently silenced.",women,bd,[1 0 0 0 1 1 1]
9312,@@70048339,vast swathes of south african land are owned by government and are not utilised or are underutilised . government can easily transfer much of this land to deserving poor families and communities .,poor-families,nz,[1 1 0 1 0 1 0]
2388,@@9437065,"fashions good and bad such as in trousers tied so low backsides showing . or dresses and skirts cut so high if a girl reaches out to pick up something from a shelf or cupboard her undies are exposed for the world to see . lavish lifestyles for the rich and famous in which they spend millions of dollars in attire , luxury vehicles on land and sea , et cetera while fellow americans wallow in misery , jobless , hungry and homeless .",homeless,tz,[0 0 1 0 1 1 0]
8712,@@7534039,"""dodgeballs were flying fast and hard at morningside college today for the 5th annual attack of the killer dodgeball tournament fundraiser . the double elimination tournament had 18 teams playing this year to raise funds for the community action agency of siouxland 's welcome home project """" . the project aims to get homeless siouxland families off the streets and , with the aid of a family-development specialist , helps them turn their lives around .""",homeless,us,[1 1 0 0 1 0 0]
8797,@@21195400,"school for the blind , deaf and dumb , isulo , anambra state , which parades a number of beautiful structures , is one of the schools battling with lack of facilities to meet the special educational needs of the children . according to felix nwaochi , president-general of isulo community , the school is seriously in need of water supply as many of the blind students have to fetch water from a stream to survive in the school .",in-need,ng,[0 0 0 0 0 1 0]
5187,@@22403994,""""""" so instead of recrimination , let us join hands in common work . let us feed the hungry , let us house the homeless , let us give work to those who have none , and let us bring medicine to those who are ill , """" uhuru said .""",homeless,ke,[1 0 0 0 0 0 0]
9488,@@4719088,"that foundation became an oasis for grant 's pen residents , and as they embraced our motto , ' doing what love requires ' , political tensions eased and hopeless young people were able to get skills training as the foundation partnered with heart trust/nta to make them employable .",hopeless,jm,[1 0 1 0 0 1 0]
9036,@@8027139,"the sound of the bulldozers coming ever closer , the presence of the bodies draped in the white eritrean shawls ( suria ) at prayer beside me , the juxtaposition of the silent petitions of hope and peace alongside the violence of destruction and hopelessness were too much for the words which tried and failed to describe the scene . witnessing became the witness of tears .",hopeless,gb,[0 0 0 0 1 1 0]
6398,@@18608357,""""""" the world today is in need of this : that joy that arises from the encounter with christ in a life of personal and community prayer , in daily listening to the word , in the encounter with brothers and sisters , in a happy fraternal life in the community , including fragility , and in the embrace of the flesh of christ in the poor . prophets of a joy that is born of feeling loved and therefore forgiven , """" he said may 22 .""",in-need,my,[1 1 0 1 0 0 0]
6843,@@4604092,"with the assistances of the shoal livelihoods programme through different ngos , over 1,00,000 poor families living in the areas of these districts have achieved the success to overcome poverty since 2004 .",poor-families,bd,[1 0 0 0 0 1 0]
6611,@@20214156,"the rda 's actions , whilst creating a stir in colombo society , are symptomatic of a much deeper national issue that mostly affects poor and vulnerable citizens . unfortunately , the woes of the poor are rarely heard . unaware of the laws and their rights , they do not have the means to hire lawyers and spend years in court to seek just compensation .",vulnerable,lk,[1 0 1 0 0 1 0]
514,@@10149340,""""""" h.e.r.o . gives a chance to employees to reach out and help those who are in need , """" shares cemex treasury operations team lead in asia daisy delos angeles . she also believes that employee volunteerism , like what they do , is indicative of employee-company 's unified mission to demonstrate concern for society .""",in-need,ph,[1 1 0 0 0 0 0]
3580,@@20029119,"""the 19th century figure of misfortune is conjured from the smokey dark of industrial leicester as a young boy who 's drunken father pleads with him to be in the world but not of it -- to tow the line and appear the same as everyone else . our elephant man does n't bear the growths and deformities of his historical predecessor , but daniel monks is physically disabled , lending so much more gravitas to the tale . he journeys from beneath the comfort of his mother 's wing , to the hostile streets , to the freak show , until even the tout rejects him because he """" makes an art form out of loneliness """" .""",disabled,au,[0 0 0 0 1 1 1]
1038,@@60058521,"but displaced people were not left homeless by developers and government agencies ; displacement and resettlement in singapore has been handled with tremendous care , and it is never begun unless replacement homes or flats for the affected are ready .",homeless,pk,[1 0 0 0 0 0 0]
1976,@@23550754,""""""" the american people , as we always have been , are there to partner with african countries to ensure their most vulnerable populations receive life-saving assistance .""",vulnerable,ng,[1 0 0 0 0 0 0]
3462,@@8546770,the candidate promises to do good things and help those in need .,in-need,hk,[1 0 0 0 0 0 0]
545,@@14978344,"this year team hope shoeboxes from ireland will go to street children , orphans , children in hospital , poor families , victims of war and other needy situations in eastern europe and former soviet union e.g. romania , kosovo , albania and africa e.g. cameroon , congo , rwanda .",poor-families,ie,[1 1 0 0 0 1 0]
8228,@@2240310,"about the same time , she gave an interview to the invisible people project , which documents the lives of the homeless ; she seems hopeless , resigned to her fate and dubious future .",hopeless,ca,[0 0 1 0 0 1 0]
9608,@@22531813,"""she said : """" i saw this need when i was helping with the eagles wings trust mobile soup kitchen in dundee . toiletries and other essentials make a huge difference to people who are homeless or have no home of their own . """"""",homeless,gb,[1 0 1 0 0 0 0]
9745,@@23947547,"defend your dignity as human beings and children of god . do not allow the rich and powerful , who are rich because you are poor , to divide you . they have light and water in their high fenced houses not because they are muslims or christians or that they are from this or that or the other tribe but simply because they are rich . you are poor , homeless , have no road , no water , and your children are sick and illiterate , not because you are christian or muslim or from this tribe or the other , but simply because you are poor . you and your children vote , but their children do not vote because they are abroad . your children beg and die on the streets while their children are abroad fraternizing with those they call unbelievers . they give you a fake religion that enslaves you while they give their own children the religion of education that will liberate them and make them rule over you .",homeless,ng,[0 0 1 1 1 1 0]
3701,@@14913223,"a cruel and violent political strategy <h> asylum seekers on manus island and nauru have been exiled , displaced , crushed and left hopeless .",hopeless,au,[0 0 1 0 0 1 0]
6035,@@14436999,"in south africa , education is a right and not a privilege , but an unfavourable background can unconsciously infringe on this right . it is an open secret that poverty is rife in our country , therefore , those who are privileged enough should assist those who do not have . it may sound like an overstatement , but there are many girls who come from poor families who miss school due to lack of sanitary pads .",poor-families,za,[1 0 1 0 1 0 0]
228,@@4268545,if these problems are not tackled there is every chance that another reporter will be back in another 20 years wondering how it is possible that vulnerable children are still being cursed with hunger and a horribly early death .,vulnerable,gb,[1 0 0 1 1 1 0]
77,@@22454828,"in september , major nottle set off on foot from melbourne to canberra to plead for a national solution to the homeless problem .",homeless,nz,[1 1 0 0 0 0 0]
8600,@@23704807,b.c. housing minister selina robinson said that the project represents hope for many women and families in need .,in-need,ca,[1 0 1 0 0 1 0]
3120,@@2096254,"an immigrant to a developed country lives in two worlds . in the metropolitan societies he encounters a different way of looking at things . he develops new ideas , gains a new confidence . in the new country there are opportunities , he gets accustomed to a good standard of living . yet he is an outsider , not fully assimilated , ethnicity and culture sets him apart from the mainstream . he yearns for familiarity , his roots . the idea of retiring to the original country comes to him .",immigrant,lk,[0 0 1 0 0 1 0]
10311,@@2390894,"""poverty . forty-seven million people rely on food stamps . thirty-eight million households have nothing saved for retirement . some 1.2 million children are homeless . an estimated 58,000 veterans live on the streets each night . these facts are a national disgrace . america 's massive , grinding poverty is eating away at our strength . what kind of a """" superpower """" allows a million children to fend for themselves on the street ?""",homeless,us,[0 0 0 0 1 1 0]
179,@@15574765,"jenny neal , regional director of the grandmothers advocacy network for saskatchewan and manitoba , displays her orange scarf at the sculpture prairie wind at river landing , thursday , november 24 , 2016 , to promote 16 days of orange to raise awareness about violence against women.greg pender / the starphoenix",women,ca,[0 1 0 0 0 0 0]
845,@@60012808,"in her tweet , reham highlighted how a ' real leader ' should protect the vulnerable communities .",vulnerable,pk,[1 0 0 1 0 0 0]
5270,@@8277081,the cape argus has launched a new collaborative editorial initiative called #thedignityproject -- a 15-part daily series about the homeless people of cape town . homeless person danny oosthuizen will be writing a daily column for the duration of the project . read the fourth entry in danny 's diary below ...,homeless,za,[0 0 0 0 0 1 0]
3959,@@1957497,"mrs gachagua attributed her kind gesture to a perennial , disturbing sight of despondent children from poor families gawping at kids from rich households as they make merry during festive seasons .",poor-families,ke,[1 0 0 0 0 1 0]
10020,@@4660263,"needless to say , whatever is the level of one 's disability , they face tenacious stigma and social exclusion in addition to their persistent physical or mental challenges . if life is hard for differently-abled adults , we can only imagine what it could be like for children . their parents become tired , frustrated , and hopeless . most of them lack financial and other resources to cope with the situation . it is almost inconceivable how burdened and helpless they feel , and therefore resort to a resigned acceptance of fate .",hopeless,bd,[0 0 1 1 0 1 0]
8680,@@21039458,""""""" every abled person today can become disabled tomorrow . so we should treat our physically challenged brothers and sisters with dignity and respect , """" he cautioned .""",disabled,gh,[1 0 0 1 0 1 0]
1510,@@23162563,""""""" someone has to be there to care , """" he says . """" i think my passion for health-care policy comes from these vulnerable people who are forgotten . this whole experience has been more invigorating than i ever thought . """"""",vulnerable,ie,[1 0 0 0 0 1 0]
282,@@4649746,"why is the voting turn-out so poor in rich countries like america , whose gdp may be high but which still has a vast majority of homeless and poor people ? democracy is not the solution to everything and most countries still do not practice democracy to its full meaning . poor countries need to show they are democratic to play the field in globalisation and modernisation and get their poor to the voting pool , who would in many cases much rather just be working on their fields as politicians never really did much for them anyway .",homeless,bd,[1 0 1 1 0 0 0]
4014,@@9061490,accountability is suggesting that the people so in need of our help and support could have done a little bit more to help themselves .,in-need,nz,[1 0 0 1 0 0 0]
6130,@@17475104,"""speaking at the elaborate event , the first of its kind in badagry , chairman of the association , comrade monday denagan honfovu , who also doubles as the president of badagry community youth association , bcya , said , the idea to assist the vulnerable women was borne out of the saying , """" if you empower a woman , you empower the nation """" .""",vulnerable,ng,[1 0 1 0 0 0 0]
9084,@@3032678,""""""" everyone makes a mistake , no one 's perfect . execution is very bad , no one likes it . we feel very sorry for these poor , poor families .""",poor-families,au,[1 0 0 0 0 1 0]
10407,@@1811952,"""he said his decision to help those in need did not benefit him personally , but """" rather such assistance was being given by all the group 's employees ... in one way or another , all of us have been helping those in need . """"""",in-need,tz,[1 0 0 0 0 0 0]
5920,@@1498580,"""mr. mathur , who was born in india , came to canada in the early seventies when he was eight years old . his hard-working immigrant parents inspired him always to be resilient , as they demonstrated by gamely facing the hardships of integrating into society , finding work and putting food on the table . he describes his upbringing as somewhat spiritual , first in downtown toronto and then in bramalea , north-west of toronto , in a working-class area filled with young families where """" it seemed everyone was the same , """" with the kids focused on academia and sports .""",migrant,ca,[0 0 1 0 0 1 1]
2226,@@15111652,mother of three on the brink of being homeless again <h> by,homeless,jm,[0 0 0 0 0 1 0]
384,@@4613249,""""""" a lot of people are in need of better roads , potable water , skills training , the education and health-care facilities that need to be developed . they all want it to happen at one time and you have to explain to them that it is a process ... and will not happen overnight . we have made a lot of achievements and i do hope that we will be able to convey fully what the vision is for the constituency and that persons will buy into exactly what we have been trying to do , """" he said .""",in-need,jm,[1 0 0 1 0 0 0]
8120,@@14964691,"now everybody wonders how she takes care of herself , living with her disabled daughter after her husband died more than 20 years ago .",disabled,ph,[0 0 0 0 0 1 0]
5023,@@19974296,"but despite the dwindling hope , yemenis refuse to give up on others in need .",in-need,in,[1 0 0 0 0 1 1]
