par_id,art_id,text,keyword,country,label
6687,@@24722775,""""""" there is no one who can tell immigrants they ca n't achieve a success that is rightfully theirs . even if the goal is n't to get a degree , any other success for immigrants in this country is deserved and waiting for them to be grasped , """" says jacqueline . """" all it takes is patience and the will to fight and move forward . no doubt in my mind any immigrant has that . """"""",immigrant,sg,[0 0 0 1 0 0 1]
7783,@@22925992,"trump seeks $25 billion for border wall , offers ' dreamer ' citizenship <h> president donald trump on wednesday previewed his outline for an immigration bill that he will promote next week , saying he wants $25 billion ( 17.6 billion pounds ) to build a border wall and is open to granting citizenship to illegal immigrants who were brought to the united states as children .",immigrant,bd,[1 0 0 0 0 1 0]
7314,@@22405707,"this time mctell performs it with the crisis choir and guest vocalist annie lennox as part of a project to end homelessness . crisis was formed 50 years ago as well and today operates 13 centres for over 4,000 homeless persons over christmas .",homeless,my,[1 1 0 0 0 1 0]
1420,@@15940510,""""""" every year i try to get somebody to help me to give some food to some homeless people , """" he continued .""",homeless,jm,[1 1 0 0 0 0 0]
6113,@@4721464,"jordan bennett commended the team of volunteers for their dedication and for sharing his vision , which is motivated by christ 's famous miracle where five loaves and two fish were used to feed 5000 persons . he said he was happy to see this level of partnership and support for an initiative that was birthed by his desire to feed especially homeless jamaicans and those in need and how it continues to blossom and impact the lives of others .",homeless,jm,[1 0 1 1 0 0 0]
4768,@@21252934,- coordinate with the private sector to donate skimmed milk powder and diapers to the newborn babies of poor families .,poor-families,jm,[1 1 0 0 0 0 0]
6389,@@1255139,"as part of the challenge , king joined up with two other families to help the homeless on thanksgiving day . she took her three children downtown this afternoon to give a blanket , coat and a home-cooked meal to homeless families they ran into . she also included a bracelet and card .",homeless,us,[1 1 0 0 0 0 0]
9345,@@22324705,"god is god foundation ( gig ) , a non-governmental organisation ( ngo ) , established five years ago , and caring for needy widows and orphans , was at the weekend inaugurated in accra , with a call on ghanaians to do more in caring for the vulnerable and underprivileged .",vulnerable,gh,[1 0 0 1 0 1 0]
360,@@14037230,call to restore hope for homeless through inquiry,homeless,nz,[1 0 0 0 0 0 0]
2154,@@15067978,""""""" the commitment of christians in this field is as urgent today as in the past . just look at the past century , we remember the wonderful figure of st. frances cabrini , who dedicated her life together with her companions to migrants to the united states of america . today too we need similar witness so that mercy can reach many in need . it is a commitment that involves everyone , without exception . dioceses , parishes , institutes of consecrated life , associations and movements , as well as individual christians , we are called to welcome the brothers and sisters fleeing war , famine , violence and inhumane living conditions . all together we are a great strength of support for those who have lost home , family , work and dignity . """"""",in-need,my,[1 0 0 1 0 1 0]
8340,@@17499482,"sr luise earned the trust of development partners and the result of her work can be seen in the number of quality institutions she founded for the aged , orphans , the homeless and refugees , including emmanuel centre and st. monica 's orphanage in kiambu county .",refugee,ke,[1 0 0 0 0 0 0]
4359,@@4562859,""""""" she was always ready to give her time , energy , legal expertise and even her personal money to assist destitute refugees and asylum seekers in jamaica , """" cochetel said .""",refugee,jm,[1 0 0 0 0 0 0]
7691,@@4685063,"who cares if he gives lots of charity to homeless children each year ? if he is n't giving it for the sake of allah , it does n't count !",homeless,pk,[1 0 0 1 0 0 0]
7888,@@50041353,kate has also worked to help liverpool 's homeless community by handing out gift boxes to women who are sleeping rough .,homeless,gb,[1 1 0 0 1 0 0]
7874,@@24959881,hope reins pairs rescued horses with kids in need <h> the faith-based organization offers equine counselors to children who have faced abuse and neglect,in-need,hk,[0 0 0 0 0 1 0]
8492,@@9129972,"for the willing and able men and women roaming on our streets in dire need of employment , for the children roaming the streets in our towns and villages due to unavailability of educational infrastructure , for the thousands of lives that are lost each day due to poor healthcare delivery , for the thousand more who go hungry and homeless on our streets , for all the lost dreams , and for the lives lost , this is our plea .",homeless,gh,[1 0 0 0 0 1 0]
9624,@@3046230,"the pcd act has the provision that a substitute decision-maker be named on your behalf if you have not previously formulated one . do you want that decision to be put in the hands of a spouse , child or even parent , in the case of a disabled child , who may not see the value of a world of imperfection ? someone who is estranged or who does not know your wishes ? someone acting because they see you as a burden to them or society ?",disabled,ca,[0 0 0 0 1 1 0]
2874,@@22405789,"the project seeks to rescue and rehabilitate enslaved and abused women and children through education and provide them with social support and protection . tlf seeks to restore hope to the hopeless , give home to the homeless , comfort to the afflicted and support to the destitute and needy children through its missions .",hopeless,gh,[1 0 0 0 0 0 0]
9256,@@19694911,i rather donate to the less privilege in the church or homeless than to pour a cup of water into nigeria sea of wealth so that the thieves can grab my little contribution .,homeless,ng,[1 0 0 0 0 0 0]
2053,@@16000035,"""the phone booth and minority report actor is a patron of the irish homeless street leagues - in his own words """" they provide provide an opportunity for those who are living without a roof over their head , or a warm bed to sleep in , to feel like they 're a part of a community , that they 're included and empowered in their lives """" - so his views on the issue of homelessness are just as valid as any expert or politician .""",homeless,ie,[1 0 0 0 0 1 0]
9598,@@16074992,"""a catholic mother convinced her family to have a different christmas . they saved money for a month and decided not to have gifts in order to help two poor families , one catholic and one buddhist . """" what i want is for my children to learn the true meaning of christmas , """" she said .""",poor-families,my,[1 1 0 0 0 0 0]
8420,@@2983739,"he would have found joy in spending time with the homeless children of manila . the children , ubiquitous in the city as they beg for alms , unfortunately missed possibly the only chance in their life to receive papal blessings . social welfare personnel spirited them away , considering the five-day papal visit a good time to introduce the homeless to dwellings with doors and sanitation facilities .",homeless,ph,[1 1 0 0 0 1 0]
3206,@@16661762,"not everyone would want to spend their special day extending help to the people who are less fortunate , and soberano is an exception . back in 2015 , the 19-year old actress chose to celebrate her 18th birthday early , giving back all the blessings she received for the year . if reaching out to those in need is in her nature , then it would n't be so hard for soberano to come up with an advocacy that she will bring to the miss universe . <h> 2 . when she attends star magic ball",in-need,ph,[1 1 0 0 0 0 0]
2405,@@1415929,we think it 's lovely that so many have come forward to help out a family clearly in need !,in-need,us,[1 0 0 0 0 0 0]
1009,@@22152320,"a deputy governor in zamfara state in nigerian , malam ibrahim wakkala muhammad , has promised to sponsor the marriage ceremony of 100 vulnerable couples across the state .",vulnerable,gh,[1 0 0 0 0 0 0]
6253,@@16604999,"this christmas , epuni baptist church volunteers will be giving away klosen 's bread to families in need .",in-need,nz,[1 1 0 0 0 0 0]
846,@@1768556,"""he reveals that coach 's corner host ron maclean ca n't pass by a busker or homeless person without opening up his wallet , and that the winnipeg jets launched a lawsuit against him after he said the team 's new assistant coach alpo suhonen 's first name sounded like """" dog food . """"""",homeless,ca,[1 1 0 0 1 0 0]
7095,@@1737715,battling homelessness through fashion is the business model of two messiah college graduates who are donating some profits from their new clothing company to help people on the streets .,homeless,us,[1 1 0 0 1 0 0]
9772,@@22365992,"last year , the star of yahweh covenant community ( sycc ) did their charity work for underprivileged families and this year , on december 10 , once again they did the same act of kindness by inviting other church members to bring the joy of christmas to these families . it was a lovely , communal way for them to gather and donate to people in need .",in-need,my,[1 1 0 0 0 0 0]
6179,@@2801377,"he could have also taken his condition to mean he must be disabled from seeking to live for others . he could have degenerated into self pity as many do , wallowing in the muddy fields of self-obsession and low self esteem . yusuf did not ; everything was not about his immediate interests , but a social impact that touched even the lives of strangers who knew nothing about him or who will never even know .",disabled,za,[1 0 0 0 1 1 1]
3355,@@4714441,""""""" every time you contribute to this christmas kettle drive , you are supporting a worthy cause . every day they feed the poor , educate the ignorant , support the widows and orphans and minister to the sick , the helpless and the hopeless . wo n't you join them with a willing heart and a generous hand ? """" custos corrodus appealed .""",hopeless,jm,[1 1 0 0 1 1 0]
7615,@@14566844,feel good food : delete to feed donates 11 meals to people in need for every food photograph posted to instagram . ( getty/instagram ),in-need,au,[1 1 0 0 0 1 0]
492,@@20554394,""""""" it was a dream of a young immigrant who came to australia with nothing but the intention to truly make a difference and i hope that work has made a real impact in many women 's lives . """"""",immigrant,au,[1 0 0 0 0 1 0]
2960,@@24735459,"""he went on to urge women to learn from that and refrain from being """" all over """" the place .""",women,gh,[0 0 0 1 0 0 0]
2194,@@4832312,pepe divides opinion among football fans but the portugal defender proved a good samaritan as he paid for nine tonnes of food to be distributed to poor families of the las rozas district in the spanish capital .,poor-families,gb,[1 0 0 0 0 0 0]
5941,@@17012782,""""""" i would like to use this opportunity to call on the government , the warring parties and all actors to support humanitarians to provide the necessary access so we can continue to bring lifesaving services to those in need , """" he said .""",in-need,za,[1 0 0 1 0 0 0]
8118,@@4042376,"liz manne , longtime independent film marketing executive , has been appointed executive director of filmaid international . filmaid , founded by producer caroline baron during the balkan crisis of 1999 , uses film to educate and bring hope to refugees and communities in need around the world .",in-need,us,[1 0 0 0 0 0 0]
9753,@@24438058,"these are all examples close to home , but they are not unique , or in isolation . there are millions of maids out there who face the same ordeal faced by the maids i have personally come into contact with . these women are victims of their circumstances . born in poor families , they are doomed to carry the legacy of their poverty all the way through to the furthest of their posterity .",poor-families,pk,[0 0 0 0 1 1 0]
10391,@@8303026,their men were rounded up into second world war-like nazi concentration camps and starved and tortured to death and their dignity and self-respect was taken from them . they were turned into an internally-displaced people and their land was transformed into a sea of desperate and suffering refugees .,refugee,ng,[0 0 1 1 1 1 0]
2325,@@1866517,"""mrs abayage said the gradual increase in female representation in parliament , politics and other areas of the society was an indication that gender had nothing to do with capabilities and therefore advised young women to look into the future with hope and pride that """" they too could become important people . """"""",women,gh,[1 0 0 1 0 0 0]
10469,@@16779383,""""""" guinness world record of 540lbs of 7-layer munchy monstrosity , """" he tweeted . """" delivered immediately to la 's midnight mission for the homeless . a good day . """"""",homeless,ie,[1 0 0 0 0 0 0]
3357,@@576408,"the former jewish neighbourhood in the city of sulaymaniah , in kurdish iraq , is not a happy place . the area is a slum where poor families are crammed into houses whose past grandeur is well concealed under a thick layer of grit and neglect .",poor-families,gb,[0 0 0 0 1 1 0]
4609,@@10184729,"""the day before , a friend had uploaded a photograph to facebook of assali feeding homeless people on the streets of berlin . the caption below read : """" acts of kindness : a syrian refugee mans a food stand for the homeless , to ' give something back to the german people ' . """"""",homeless,gh,[1 1 0 0 0 0 1]
7349,@@7808933,the charity has a number of success stories where people have been homeless and are now leading happy lives in employment .,homeless,gb,[1 0 0 0 1 0 0]
4997,@@14176765,"crooks said she is appealing to persons to be more sympathetic to the homeless and mentally ill , as it could happen to anyone .",homeless,jm,[1 0 0 1 0 0 0]
765,@@1873485,"finally , there seems to be a ray of hope for the poor and the vulnerable in nigeria 's rural communities as far as health care services are concerned . an estimated 70 per cent of nigeria 's population who live in the rural areas are said to have higher disease burden , lower income , and are in most need of protection .",vulnerable,ng,[0 0 1 0 1 1 0]
7213,@@4617409,"according to the data of the national disaster management authority , 386 people were killed and 816 injured . malar and mashkai tehsils of awaran were the worst hit . the ndma confirms more than 32,000 houses were flattened out and more than 14,000 partially damaged . unofficial sources claim that the digits are watered down . numbers aside , death and devastation is certainly enormous . life is still scrambling through the heaps of debris particularly in awaran district . countless people are still homeless taking shelter with their relatives and acquaintances in neighbouring lasbela , hub and other areas .",homeless,pk,[0 0 0 0 1 1 0]
9081,@@19672365,""""""" she was in a vulnerable , helpless , hopeless situation when the two men entered her home .""",hopeless,ie,[0 0 0 1 0 1 0]
9843,@@1970496,"the christchurch city mission : our blithesome city missioner michael gorman is unfaltering in his ambition to help vulnerable people in our community . his vision for a modern facility for people in need was realised this year and , with architect alun wilkie , gorman has created a special and inspirational space where people can get respite from , at times , very bleak lives .",vulnerable,nz,[1 0 0 0 0 1 0]
8857,@@1893516,"azumah described the book , the proceeds of which would be injected into his akuse-based foundation , as the second chapter of his life and hinted that supporting the initiative equals to fighting illiteracy , poverty , and homelessness among children in the country .",homeless,gh,[1 0 0 0 0 0 0]
10347,@@1025551,"the white house kitchen garden has evolved from a mere decorative space to a major producer of ingredients used for events at the white house , whose kitchen garden now feeds homeless people .",homeless,ph,[1 0 0 0 0 0 0]
4965,@@1834898,he said he is thrilled to be participating in what really is a life changing opportunity for the country 's children who were at one time homeless abandoned and without hope .,homeless,tz,[1 0 1 1 0 1 0]
10191,@@7199810,""""""" what poor families really need is more money . the government 's weak response is to give beneficiaries with children an extra $25 a week starting april 1st . sure , that will help some families but it is really tip of the iceberg stuff .""",poor-families,nz,[1 0 0 1 1 0 0]
6931,@@20681266,2 . limiting interest charged in relation to the ocr . loan sharks target the poor and keep them trapped in the prison of poverty with crippling interest rates . government can help here with some protection for the vulnerable .,vulnerable,nz,[1 0 0 0 1 1 0]
496,@@26214070,"hundreds of thousands of rohingya refugees living in sprawling camps in bangladesh are celebrating the muslim holiday of eid al-adha , praying for better lives as they wonder if they 'll ever again celebrate at their homes in myanmar . people streamed into makeshift mosques in the camps , the children dressed in new clothing . those who could afford it feasted on buffalo meat . muslims often sla ...",refugee,hk,[0 0 1 0 0 1 0]
4060,@@8618742,unicef afghanistan/afp / mahdy mehraeenafghan boy murtaza ahmadi proudly wears one of the jerseys sent by his idol lionel messi <h> the young afghan boy who captivated hearts after he was pictured wearing a plastic bag as an improvised lionel messi jersey has appealed to the un refugee agency after fleeing afghanistan .,refugee,za,[1 1 0 0 1 1 0]
4830,@@25759381,the level of diligence and zeal for success that women have portrayed over the years has made them reach the pinnacle of success which they enjoy today . gone are the days of subjecting women to secondary roles in society .,women,tz,[0 0 1 1 0 0 1]
353,@@3230571,""""""" these migrants , many of whom are refugees , are desperate for a better future , """" ban said . """" we need to strengthen search and rescue operations , and stop the criminals who exploit the most vulnerable people . we need to address the roots of the problem . """"""",refugee,sg,[1 0 0 1 0 1 0]
9719,@@1857896,"in many cases , resultant effects of such type of living is the elderly looking frail ' past their usefulness , unable to work , physically weak , mentally slow disabled or hopeless .",hopeless,tz,[0 0 1 1 0 1 0]
1266,@@16643759,"""this discarded corpse , latterly a boy who had been taught to sing about being """" a bundle of potentiality """" , she says , was erratic in school attendance and behaviour , most often hungry and unkempt and demonstrably lacking in affirmation and attention at home , foisted on teachers , who , obsessed with curriculum , hopefully willing but hopelessly ill-equipped to save him from his ( and our ) final resting place .""",hopeless,jm,[1 0 0 0 1 1 0]
5427,@@22625926,"on hunger , homelessness , disease : this is the lot of the poor and unwashed . accepted na ( they 're expendable ) .",homeless,ph,[0 0 0 0 0 1 0]
6501,@@15562743,"i 'm a big supporter of the charity dress for success , which provides professional clothing and styling tips for women in need for job interviews . most of those helped have come out of violent relationships or prison , and a new suit and hair and makeup goes a long way in shoring up the confidence needed to secure a job and improve your financial future .",in-need,au,[1 1 1 1 0 0 0]
6013,@@15903800,"attaching a photo showing pi ? ol with dole senior vice president for worldwide agriculture and research carlos mandujano and other officials of dole-philippines during their meeting at the matina golf club in davao city last december 10 , pi ? ol wrote that dole-philippines will be donating to poor families the pineapple leaves from their more than 18,000-hectare plantations all over mindanao .",poor-families,ph,[1 1 0 0 0 0 0]
3087,@@23215041,"thus , the education -- labour market connection is characterised by a vicious circle whereby poor children obtain poor quality education , which in turn limits their participation in the economy and obstructs the next generation 's efforts to get a good education . our research has identified low-quality education as the main poverty trap holding back upward mobility of children from poor families .",poor-families,ie,[0 0 0 1 1 1 0]
8281,@@18454630,"""the statement signed by ikonomwan francis , leader of smn , read : """" there is no doubt that nigerians are in need of capable hand to man the office of sgf that will join the president to bring smiles to their faces in the second half of this administration . """"""",in-need,ng,[1 1 0 1 1 0 0]
966,@@4615045,the group became so highly concerned with a homeless man whose plight was brought to national attention by the local news station when tropical storm nicole struck the island back in september 2010 that they arranged with the st. joseph ? s golden age home to have the homeless man admitted as a resident . it was that episode that provided the impetus to make the st. joseph ? s golden age home christmas treat a now annual charity event on the social commentary group ? s calendar .,homeless,jm,[1 1 0 0 0 0 0]
8559,@@24274288,"thankfully , while krishna tulasi ca n't entirely escape from the trope of disabled persons with hearts of gold , it manages to do better than many previous films with disabled protagonists .",disabled,sg,[0 0 0 0 0 0 1]
4125,@@907472,"yong is not the first sabahan to find himself on the wrong side of the law , and neither will he be the last . another boy from sabah was lee siaw foo , who was convicted of trafficking heroin into singapore . lee , too , came from a family facing hard times ; his mother a bankrupt , his father in need of an operation after a heart attack . as the only child and sole breadwinner , he agreed to deliver packages in malaysia and singapore . the packages turned out to be heroin . yong told his lawyer that in 2009 lee was dragged kicking and screaming from his cell to the gallows .",in-need,sg,[0 0 0 0 1 1 0]
5114,@@17147404,theirs are tears of emotion for lives lost . tears of anger for being uprooted from their homes . tears of hopelessness borne out of the knowledge that there is little they can do . they are tears nudging them to revenge .,hopeless,ke,[0 0 1 1 0 1 0]
5649,@@15887811,"as minister of canadian heritage , i thank his highness for all he has done to help those in need , and join with canada 's ismaili community in wishing him a very happy birthday . khushali mubarak !",in-need,ca,[1 0 0 0 0 0 0]
821,@@25280012,""""""" we have a wave of refugees fleeing wars and hunger , war and hunger in so many countries of africa , wars and persecution in the middle east , """" he said , congratulating in particular italy and greece which had been """" extremely generous """" in their welcome , just like turkey or lebanon .""",refugee,tz,[1 0 0 0 0 0 0]
3406,@@30032736,"""as maas put it , """" the loss of this organisation could unleash an uncontrollable chain reaction . """" kids would be pushed from unrwa classrooms onto the streets , where they would be more vulnerable to dangerous scenarios such as recruitment efforts by terrorists , who will surely jump at the chance to argue that if we ca n't keep our aid promises , peaceful coexistence with the west is impossible . child marriage , child labour , and child trafficking would rise . a generation of children and young people would be lost , in a region more unstable than ever .""",vulnerable,bd,[1 0 1 0 1 1 0]
6509,@@60102259,""""""" evros is not just the border , """" he said . """" evros is here in thessaloniki . they are here , homeless , without any provision of service . """"""",homeless,tz,[0 0 0 0 0 1 0]
2879,@@14108898,you are not a country when you comfortably watch starvation waste your most vulnerable and innocent citizens . you are not a country when allow the people that fled the instant butchery of terrorists and ran into your arms die of hunger and thirst in dozens . you are not a country when you collect the weak and the poor and abandon them to ' mercy killing ' food denial !,vulnerable,ng,[1 0 0 1 1 1 0]
9342,@@8089709,"wow , all five of these women are so dedicated and have given so much back to those in need , it is so inspiring ! what do you guys think of their flawless covers ? vote @",in-need,us,[1 0 0 0 0 0 0]
1115,@@20705867,""""""" we have to sit down , dialogue with those who are agitating and start looking at meaningful solutions that can give them hope . once a country makes her people to develop a sense of hopelessness , the people will agitate a lot . """"""",hopeless,ng,[1 0 0 1 0 0 0]
9690,@@22524510,"what i have found , especially with the last woman i dated , is that many women expect everything to be provided ( even when i have suggested some sharing ) for women who believe themselves to be strong and independent individuals . they 'll belt out i am woman , while i pick up the tab .",women,ca,[0 0 0 1 0 0 0]
4112,@@23086177,"""immigration again emerged as a possible point of contention . house democratic leader nancy pelosi , who helped negotiate the accord , nevertheless said she would oppose it unless ryan promises to advance legislation to protect hundreds of thousands of young adult immigrants , known as """" dreamers , """" brought to the united states illegally as children .""",migrant,sg,[0 0 0 0 0 1 0]
3721,@@142837,"children 's hour , a program of child foundation inc. , requires volunteers to donate at least an hour of their time and worth to kids in need .",in-need,ph,[1 1 0 0 0 1 0]
