par_id,art_id,text,keyword,country,label
1703,@@7922927,"as for men who abuse women , the least said about them the better . and to those who seek sexual favors from vulnerable women ... ayekoo ! ( well done ! ) for all you know , you are the ones promoting sex workers in the world today . as i mentioned earlier , most of these women have good hearts and their behaviors may have been triggered by a horrible background , find out and be good towards them . marry them if it demands you should .",vulnerable,gh,[1 0 1 1 0 0 0]
6133,@@3921813,"denied dignity and hope , despair and anger have set in among arab jerusalemites . young palestinians see their parents ' despair and see their own futures as devoid of promise . this sense of hopelessness is the root cause of the current violence .",hopeless,us,[0 0 1 1 1 1 0]
2316,@@14172407,"a refugee is that boy . a refugee is a person , with a story , a life , a family , accomplishments , hardships , hopes and a desire for safety and belonging .",refugee,hk,[1 0 0 1 0 1 0]
9645,@@1936157,"""francis said it was not enough to say , """" have courage , hang in there """" , to the hundreds of thousands of refugees who are on the march toward what he called """" life 's hope """" .""",refugee,gh,[1 0 0 1 0 1 0]
864,@@4531820,the minimum requirements of job experience averaging between two and three years for advertised jobs has done nothing but to deprive youngsters of the opportunities to work and earn a respectable living for themselves . it has just rendered them hopeless .,hopeless,pk,[0 0 1 0 0 1 0]
7912,@@4925131,let us follow in mary 's footsteps and bring hope to the hopeless,hopeless,lk,[1 0 0 0 0 1 0]
3115,@@15012456,"""while the future of the peace process remains uncertain , the hard fact that the government must tackle now is to not just take back the """" failed """" refugees but also ensure that they are not devoured by the same demon they had fled from in the first instance .""",refugee,in,[0 0 0 1 1 1 0]
1951,@@15677351,"many of them sought refuge in malaysia only to be treated as outcasts to be whipped , incarcerated , deported , trafficked or abused . why was no consideration given to allowing the thousands of these refugees to work as there is now for the rohingya ? did the fact that they were non-muslim disqualify them from compassionate treatment ?",refugee,my,[1 0 1 1 0 1 0]
5798,@@1792462,"he said the current local derivatives or names exudes grimness , somberness and suggests even the macabre in the minds of people so that sufferers were often tagged hopeless cases even where there was hope .",hopeless,gh,[0 0 0 0 0 1 0]
600,@@19599236,he also gave out food to poor families selected by the local social development office .,poor-families,za,[1 0 0 0 0 0 0]
5207,@@16935997,"he lost both his parents within a month of each other , and now a young tauranga man is facing the prospect of becoming homeless .",homeless,nz,[0 0 0 0 0 1 0]
3257,@@1038600,"""speaking after the inquest antony 's mum , zena stevens , said : """" it 's an unbearable loss . antony was n't a druggie , he was just a very vulnerable young man .""",vulnerable,gb,[0 0 0 0 0 1 0]
1443,@@23976983,"the photo of a hyderabad traffic policeman feeding an elderly homeless woman has gone viral , earning him accolades from social media users and from the home minister of the state .",homeless,sg,[1 1 0 0 0 0 0]
2350,@@14299094,"""all these services were primed towards , in mother teresa 's own words , """" the hungry , the naked , the homeless , the crippled , the blind , the lepers , all those people who feel unwanted , unloved , uncared for throughout society , people that have become a burden to the society and are shunned by everyone . """"""",homeless,ng,[1 0 0 0 0 1 0]
381,@@16393278,"""she asks , with despair in her voice : """" what 's the point of cooking for the homeless when the homeless ca n't cook for themselves tomorrow ? """" throwing her hands up in the air , she retorts : """" how was i supposed to start when i did n't have the funding ? """"""",homeless,my,[1 1 0 0 0 1 0]
6040,@@8909155,karachi : sindh chief minister syed qaim ali shah has directed social welfare department to establish a centre for elderly homeless people so that they could live respectfully without working hard and even without stretching their hands before others .,homeless,pk,[1 0 0 0 1 0 0]
3724,@@10363188,"this collaboration between institut onn ja'afar ( ioj ) with yayasan chow kit ( yck ) invites all malaysians to give breakfast to the homeless by starting their soup kitchen as early as 7am . they operate once every two weeks , on the first and third wednesdays of each month outside kl krash pad at 346 , jalan tuanku abdul rahman .",homeless,my,[1 1 0 0 0 0 0]
7332,@@983938,un app lets you know what life as a refugee is like,refugee,za,[1 0 0 0 0 1 0]
5530,@@19656734,""""""" let us also remind lauretta that nigerians are waiting eagerly to have her and her bosses in prison as soon as 2019 comes . they must account for the monies they allegedly stole from the idps , the poorest of the poor , through babachir lawal , and still went ahead to bomb them to death in rann in their state of hopelessness and helplessness .""",hopeless,ng,[0 0 0 0 0 1 0]
798,@@2577871,"i have a dream journal . sometimes , i create ads from dreams . yellow man for digi being one of them . is that considered weird ? i 've also dressed up as a homeless man for a shoot once , but decided to stay like that for a few more hours after experiencing being ignored and feeling invisible . it was an eye opener .",homeless,sg,[1 1 0 0 1 1 0]
4313,@@136151,"as a little girl , i would cry walking down the streets of toronto because i did n't know how to help the homeless people . i began to feel like that little girl again , heartsick over people 's hardships . but there was one major difference : no longer did i feel that all was hopeless .",homeless,ca,[1 0 0 0 1 1 0]
1194,@@2306623,"there is fear and desperation in their empty eyes . they have no livelihood and no work and their growing children receive no education . their daughters do not have much hope of finding suitable matches and they are not certain where the next meal would come from . many women and children live in gurdwar , sikh place of worship relying on free kitchen",women,in,[0 0 1 0 1 1 0]
8983,@@4605140,""""""" initially i wanted the charity to be about helping jamaicans on a whole , but i figured i would start where people are the worst off , which i believe are the homeless people , because they literally have nothing , but now since i have the other people on board , it is going to be more widely spread to education and general poverty , """" she said .""",homeless,jm,[1 0 0 0 0 1 0]
3411,@@25385669,"the hopelessness , dejection and frustration by a teary betty kaveke summed up the despondency around gikomba on this tragic morning of a june thursday . east africa 's ' supermarket ' of second-hand clothes was once again grieving . a dawn fire , had once more visited the sleeping residents gutting property worth millions .",hopeless,ke,[0 0 0 0 1 1 0]
3965,@@232714,"he may well have depression and this may have led him to become so withdrawn , reclusive , lethargic , and trapped . or his lifestyle and daily habits may have led to him becoming depressed and hopeless .",hopeless,ie,[0 0 1 0 0 1 0]
9846,@@4521781,news <h> from homeless to hopeful <h> portland 's indigent get a roof over their heads,homeless,jm,[0 1 0 0 1 1 0]
5508,@@23720891,"in general , people live inside their own bubble . people who move to a new country , especially refugees and asylum seekers , are forced to leave this bubble . this can make them feel very anxious , very traumatised -- like a fish leaving water .",refugee,ie,[0 0 1 0 1 1 0]
6906,@@1907523,"""in his remarks , the usaid deputy administrator , alfonso lenhardt , said : """" having served as the u.s ambassador to tanzania , i have seen how improving access to electricity can empower vulnerable communities to escape from the cycle of extreme poverty . """"""",vulnerable,tz,[1 0 1 0 1 1 0]
4753,@@474212,""""""" what is at stake is nothing less than the survival and wellbeing of a generation of innocents , """" antonio guterres , the un high commissioner for refugees .""",refugee,ph,[1 0 0 1 0 1 0]
83,@@4672144,"the demographics of pakistan and india are very similar . poverty is a widespread issue . according to the fao , 40 percent of children in pakistan are malnourished and underweight due to lack of access to adequate food . and this is not because there is n't enough ; pakistan is the 8th largest food producing country , however , 50 percent of the population is food insecure . with the massive income inequality that persists , rha is a brilliant movement . we collect leftover or extra food from restaurants and distribute it to the homeless and hungry in the locality .",homeless,pk,[1 1 0 0 0 0 0]
4319,@@14028752,"at a ceremony held in accra , she said the presence of disable persons begging on the streets and the absence of ambulance to aid in the transfer of patients in need of critical help , moved her to donate the items .",in-need,gh,[1 1 0 0 0 1 0]
1396,@@20682847,"""with the spotlight on her at the un , the prime minister started her speech by saying : """" this is the 14th time i am addressing the un general assembly . and this time i have come here with a heavy heart . i have come here just after seeing the hungry , distressed and hopeless rohingyas from myanmar who took shelter in cox 's bazar , bangladesh . """"""",hopeless,bd,[1 0 0 0 0 1 0]
5177,@@25601417,"however , and most importantly , it should be a moment for all partners to embrace the ogp platform to fundamentally change how we design and deliver essential public services for those most in need of government support -- for their survival and dignity .",in-need,sg,[1 0 0 1 0 1 0]
5501,@@20434202,"in a new joint the hollywood reporter interview , the couple reveals the yazidi refugee is now thriving as a student at the university of chicago after surviving a living hell in his homeland .",refugee,ie,[1 0 0 0 1 1 0]
3138,@@21927448,"the spirit the rwandese have shown to accommodate the people , almost a tribe in their tiny country with approximately 19 million people with meager resources just like any other third world country , without planning to ditch them in refugee camps , but offer them to live just like any other citizen should actually be emulated in the human race .",refugee,tz,[1 0 0 0 0 0 1]
3678,@@21927448,"noting that the country was not oblivious to the financial resources and other costs that could come with the decision , she said it would be against national values of rwanda to turn a blind eye to the plight of the immigrants .",migrant,tz,[1 0 0 0 0 0 0]
5914,@@21927448,"but the concept is that rwanda 's remorse , humane , policy and culture of helping the immigrants/slaves to be , thousands of miles away in the continent should make eac feel that the 30,000 people ( creation of god ) is the bloc 's baby now to nurture , educate , cloth and house just like any other citizen in the community .",immigrant,tz,[1 0 0 0 0 0 0]
5164,@@15464145,"bundaberg salvation army captains melissa and chris millard said last year , through the generous support of the community , the salvation army was able to help many families and individuals in need .",in-need,au,[1 0 0 0 0 0 0]
2321,@@14062365,"rio 2016 produced many memorable moments . the inclusion of a refugee team was a first -- and a great initiative ; swimmers like yusra mardini and ramis anis may not have won medals but they certainly seemed to have won the hearts of spectators . then there was the magic of 19-year old american simone biles ' gymnastics and the thrill of the track as usain bolt flew over the finish line -- again . sporting heroes bowed out from the olympic stage , young competitors stepped forward with thrilling performances .",refugee,pk,[1 1 0 0 0 1 0]
1763,@@4231652,"as the gillard government 's proposed ' ' malaysia solution ' ' and refugee swap deal inches closer to official ratification , with reports a draft agreement has been reached , more than 400 suspected asylum seekers are awaiting their fate on the small island , placing a strain on the already severely stretched infrastructure .",refugee,au,[1 0 0 0 0 1 0]
10102,@@9917783,"after being hit by a burst of pellets in his face , twenty-year-old omar altaf of islamabad from south kashmir is disabled forever . he has lost the vision in his left eye while his right eye has faint sight . his blaring eyes are witness to the mayhem he saw on roads when indian forces fired pellets .",disabled,pk,[0 0 0 0 0 1 0]
3820,@@16605,avc : could you relate to that kind of hopelessness and despair ?,hopeless,us,[0 0 0 0 0 1 0]
8325,@@14942580,"betty abah is passionate about this initiative that seeks to protect young , vulnerable children . you could tell from just listening to her and how her face lit up as she dissected each question that was thrown at her .",vulnerable,ng,[1 0 0 0 0 0 0]
5865,@@19042211,"the pope also called on the faithful to reach out , saying that personal encounters with migrants and refugees can help dispel distorted fears and ideologies .",refugee,za,[1 0 0 1 0 0 0]
1987,@@1831109,"i find it ironic to believe that in a well developed country like the u.k child benefits is offered to every child plus free education , school trips . ghana on the other hand , an under developed country has no child benefits system for its children , or housing benefit and i write some children to date are being educated under the trees in this 21st century ghana . for example , the child benefit was introduced in britain in 1798 and later stopped but reintroduced in 1909 . how could our system help poor families to help with ghana economy ? what is stopping ghana in addressing poverty within families and emulating this forward thinking attributes of british in eradicate child poverty . this approach from make a difference and give children and families a better chance in life .",poor-families,gh,[1 0 0 1 1 0 0]
7828,@@14597913,"""during a meeting with peef scholars on wednesday , he said that talented and hardworking students showing good performance in educational field were pride of the nation . """" it is a fact that the dream of progress and prosperity can not be realized without equipping the new generation with modern knowledge . while children of the elite can get admission in prestigious educational institutions anywhere in the world , brilliant children of poor families who have a thirst for knowledge should also have opportunities of quality education , """" he cm assured .""",poor-families,pk,[1 0 0 0 1 0 0]
1753,@@25189561,"""according to the us substance abuse and mental health services administration ( samhsa ) , """" suicidal experiences are about overwhelming emotional pain where one feels trapped , alone and hopeless . it is not their life that they wish to extinguish ; it is this pain they want to kill """" .""",hopeless,lk,[0 0 0 1 0 1 0]
7849,@@4717478,"he described the life of young muslims in the district as hopeless , with many feeling stateless and confronting unemployment rates well above the national average . most of his friends , he said , had done jail time .",hopeless,pk,[0 0 1 1 0 1 0]
1835,@@9058645,"""on the red dot show producer serene chen said she was heartened by the kindness shown from members of the public . said ms chen : """" it is telling of a society that is not apathetic towards those in need even as we pursue our own success . """"""",in-need,sg,[1 0 0 0 0 0 0]
9070,@@3607549,"""but it 's really not that incredible any more , is it ? this is the same government that considers every shell-shocked gazan child and every desperate syrian refugee clinging to a rubber raft to be a potential terrorist . this is the same prime minister who lied shamelessly to canadians during last week 's debate when he claimed the the liberals and new democrats """" would have had , in the last two weeks , us throwing open our borders and literally hundreds of thousands of people coming without any kind of security check or documentation . """"""",refugee,ca,[0 0 0 0 0 1 0]
10244,@@18692410,""""""" research conducted by unicef in 2013 found that the number of disabled children in child and youth care centres is three times that of our general childhood population in south africa . not only are these children abandoned , they must contend with a disability or disorder that will impact them for the rest of their lives , """" noted blackie .""",disabled,za,[0 0 1 0 0 1 0]
3695,@@33539,""""""" we are in a state of mourning but we have to carry on because we have a duty to those people who are so in need of our support . """" mr bird said thousands of people worldwide had paid their respects to the two men , with tributes from as far afield as australia .""",in-need,gb,[1 0 0 0 0 0 0]
2767,@@23925,"christian missionaries care for the destitute , and jain sects serve and feed the disabled . islamic traditions require setting aside a regular fraction of one 's earnings to feed the hungry and destitute . i find in muslim ghettoes of delhi like nizamuddin and jama masjid , even today , a number of wayside eateries that offer plastic tokens for sale . these are bought by people who eat at the restaurants , and they distribute these to destitute people . each token can be redeemed by them for a meal , when they are in need of food , over a period of a month .",disabled,in,[1 1 0 0 0 0 0]
1916,@@2278407,"youth belonging to poor families need to be equipped with the skill and provided with opportunities to improve their life conditions , instead of being bestowed with freebies which amount to make them walk with begging bowl all the time and life long .",poor-families,lk,[1 0 0 1 1 1 0]
7720,@@20376720,"in this photograph taken on december 6 , 2010 abdul sattar edhi , head of pakistani 's edhi foundation holds a disabled orphan at the orphanage of the charity in karachi . photo : afp",disabled,pk,[1 1 0 0 0 0 0]
3201,@@10135092,"meanwhile , social and family development minister tan chuan-jin said his ministry would focus on strengthening marriages and families , providing a good start in life for the young , helping the vulnerable and fostering a caring community .",vulnerable,sg,[1 0 0 0 0 0 0]
3174,@@9387778,"they care for our children , elderly , disabled , and homes , but are we doing enough to take care of them ?",disabled,jm,[1 0 0 1 0 0 0]
6069,@@25789461,"dar es salaam . a network of members of parliaments from across europe , who are committed to protecting sexual and reproductive health of the world 's most vulnerable people , has called on tanzania to work on family planning issues for the country to easily transform into the middle income economy .",vulnerable,tz,[1 0 0 1 0 0 0]
9698,@@13609212,"these actions must , also , seek to enhance the sense of citizenship and active participation of foreign nationals and immigrants , as well as educating them on the values of tolerance and the rejection of all forms of discrimination , racism and hatred .",migrant,gh,[1 0 0 1 0 0 0]
9168,@@14922611,"""i wanted to humanise personal stories hoping people would take notice of the breadth and complexity of children seeking refuge . i was totally committed to taking every chance to put a human face to children refugees and to deliver a fresh and unique photography . """"""",refugee,ng,[1 1 0 0 0 1 0]
9923,@@1915219,"the first point worth mentioning is low levels of living , characterized by low incomes , inequality , poor health and inadequate education . in developing countries , the levels of living tend to be very low for the vast majority of people . these low levels of living are manifested quantitatively and qualitatively in the form of low life and work expectancies , high infant mortality rate and in many cases a general sense of malaise and hopelessness .",hopeless,gh,[0 0 1 0 0 1 0]
9663,@@18602719,"back to the commercial , the artists mentioned above request the audience to donate for homeless children , senior citizens and above all for edhi , who was always willing to lend a hand to anyone who needed it .",homeless,pk,[1 0 0 0 0 0 0]
3683,@@23098571,"""many of us struggle with a particular behavior or trait we just ca n't seem to kick , even though we know it does n't please god . these weaknesses can leave us feeling defeated , hopeless , and full of despair . but there 's hope ! the transforming power of the holy spirit is still available today . once we surrender our hearts to christ , romans 8:9 says that """" we are not controlled by our sinful nature . """"""",hopeless,ph,[1 0 0 0 0 1 0]
7256,@@3198062,"""the subtext of the finished work is that the women who dared to choose """" average """" must have made some kind of mistake . what were they thinking ? at the very least , they must be beset with tedious false modesty or a harmful ( not cultural ) self-deprecation habit . they 're probably also candidates for body dysmorphia and/or a full-blown existential crisis . clearly , they lack self-esteem .""",women,ie,[0 0 1 1 0 0 0]
1229,@@8783796,"""12 . chris hipkins ( labour -- rimutaka ) to the minister of education : why does she accept some responsibility as minister of education for hon bill english 's statement that a lot of kiwis are """" pretty damned hopeless """" and """" they ca n't read and write properly """" ?""",hopeless,nz,[0 0 1 0 0 1 0]
5806,@@1844517,"speaking to africa review , he also pointed out that majority of these children come from very poor families with no permanent level of income since most of their parents are casual labourers who earn peanuts .",poor-families,ke,[0 0 1 0 1 1 0]
8240,@@1819877,"what is the basis for the conflict in our nation ? are we to end up like some of our neighboring countries forever at war , displaced with stagnant economies , tremendous psychological trauma , malnutrition , and rising death tolls ? have you seen how our fellow african refugees are treated ?",refugee,tz,[1 0 0 0 0 1 0]
5773,@@25769797,"the drop in centre in eruera street needs urgent permission to also serve as an over night shelter until other options are ready , according to the rotorua district residents and ratepayers association , so that the homeless currently sleeping rough survive the winter .",homeless,nz,[1 0 0 1 1 0 0]
6373,@@8197275,"""yet they find a reason to keep their wealth out of reach . they see hunger , gory poverty , decadence , death and hopelessness around them all the time , yet all they do is , keep so much away from humanity . it is honourable to be rich but it is even more honourable to be generous , let alone fair . like the old bible says , """" to whom much is given much is expected . """"""",hopeless,gh,[1 0 0 0 0 1 0]
197,@@7384248,"it is understandable to want to protect one 's home and family from the conflict , but we must rally together as humans , understanding that we have a responsibility to help the world 's most vulnerable to survive and rebuild their lives . there are hundreds of thousands of refugees who want nothing more than a safe place for themselves and their families . they travel under incredibly dangerous circumstances to avoid having to live in places ravaged by war and terror . their suffering is something that we should all understand . the countries neighboring syria such as jordan , lebanon , turkey and iraq have already taken in millions of people and can take no more .",vulnerable,us,[1 0 1 1 1 1 0]
7104,@@18693604,"when you see others in need , support them .",in-need,nz,[1 0 0 0 0 0 0]
10379,@@30026901,""""""" many children from poor families and working class households have struggled to gain entry into universities because their parents could not pay the fees . so if you come from a poor family you are condemned forever ? to remain an inferior person ? """" he said .""",poor-families,za,[0 0 1 1 1 1 0]
2919,@@1871154,"they could do so by supporting the construction of schools , health facilities and other social amenities for use by their neighbours . that would be an excellent way of complementing the government 's efforts in uplifting the welfare of our people , most of whom live below the poverty line and are badly in need of assistance aimed at adding meaning to their lives .",in-need,tz,[1 0 1 1 1 1 0]
4279,@@3884959,"over the last year , they have helped provide various types of support to numerous struggling individuals and families by matching those wanting to give help to those who need it , from painting and decorating family homes in poor condition , organising days out for underprivileged children and helping the homeless .",homeless,gb,[1 1 0 0 0 0 0]
8030,@@17505914,"what nations need to do is begin to rebuild the spiritual walls that were broken down , as in the book of nehemiah . any nation that shows mercy and compassion to refugees and undocumented personnel will receive great blessings from the creator who is the one who gives power to get wealth . <h> paying taxes",refugee,jm,[1 0 0 0 0 0 0]
1619,@@18984294,""""""" by donating blood , many lives are saved and hope is given to many whose situation might otherwise be hopeless .""",hopeless,ng,[1 1 1 0 0 1 0]
1358,@@4525870,"but this could be devastating for the disabled and elderly , who lack the agility to cope with anything sudden and unexpected , they added .",disabled,bd,[0 0 1 0 0 0 0]
275,@@3520216,"the portuguese superstar has raised money for various causes , including donating more than $83,000 to a 10-year-old fan in need of brain surgery . he is also a global spokesperson for organisations that tackle issues around childhood hunger , obesity and biodiversity , among others .",in-need,za,[1 0 0 0 0 0 0]
